{
  "case_id": "crusader-states-public-case",
  "claims": [
    {
      "challenging_observation_ids": [],
      "claim_id": "E_1130_JERUSALEM_POINT",
      "entity": "Kingdom of Jerusalem",
      "rationale": "The cited observations support this deliberately narrow semantic role.",
      "semantic_role": "point_control",
      "slice": 1130,
      "spatial_scope": {
        "kind": "point"
      },
      "statement": "Jerusalem is retained as a point-control anchor only. Jerusalem was the royal center in 1130; this supports a city anchor, not a continuous border.",
      "status": "supported",
      "supporting_observation_ids": [
        "OBS_CSB1130_001_1",
        "OBS_CSB1130_001_2",
        "OBS_GEONAMES_281184"
      ],
      "temporal_scope": {
        "slice": 1130
      }
    },
    {
      "challenging_observation_ids": [],
      "claim_id": "E_1130_DAMASCUS_POINT",
      "entity": "Burid Damascus",
      "rationale": "The cited observations support this deliberately narrow semantic role.",
      "semantic_role": "point_control",
      "slice": 1130,
      "spatial_scope": {
        "kind": "point"
      },
      "statement": "Damascus is retained as a point-control anchor only. Damascus was the center of an active Burid polity in 1130; frontier relations do not imply a precise boundary.",
      "status": "supported",
      "supporting_observation_ids": [
        "OBS_CSB1130_004_1",
        "OBS_CSB1130_004_2",
        "OBS_GEONAMES_170654"
      ],
      "temporal_scope": {
        "slice": 1130
      }
    },
    {
      "challenging_observation_ids": [],
      "claim_id": "E_1130_ASCALON_POINT",
      "entity": "Fatimid Egypt",
      "rationale": "The recovered material does not yet satisfy the public baseline threshold; the claim remains scenario-only.",
      "semantic_role": "disputed",
      "slice": 1130,
      "spatial_scope": {
        "kind": "point"
      },
      "statement": "Ascalon is retained only as a disputed 1130 scenario anchor. The available locators do not yet meet the page-level standard for the reviewed baseline.",
      "status": "unresolved",
      "supporting_observation_ids": [
        "OBS_CSB1130_005_1",
        "OBS_CSB1130_005_2",
        "OBS_GEONAMES_293400"
      ],
      "temporal_scope": {
        "slice": 1130
      }
    },
    {
      "challenging_observation_ids": [],
      "claim_id": "E_1130_TRIPOLI_POINT",
      "entity": "County of Tripoli",
      "rationale": "The cited observations support this deliberately narrow semantic role.",
      "semantic_role": "point_control",
      "slice": 1130,
      "spatial_scope": {
        "kind": "point"
      },
      "statement": "Tripoli is retained as the county center in 1130. The claim is limited to the city; it does not establish a county footprint.",
      "status": "supported",
      "supporting_observation_ids": [
        "OBS_CSB1130_006_1",
        "OBS_CSB1130_006_2",
        "OBS_GEONAMES_266826"
      ],
      "temporal_scope": {
        "slice": 1130
      }
    },
    {
      "challenging_observation_ids": [],
      "claim_id": "E_1130_TORTOSA_POINT",
      "entity": "County of Tripoli",
      "rationale": "The recovered material does not yet satisfy the public baseline threshold; the claim remains scenario-only.",
      "semantic_role": "disputed",
      "slice": 1130,
      "spatial_scope": {
        "kind": "point"
      },
      "statement": "Tortosa is plausible as part of the county core, but the reviewed pages do not independently establish this point for 1130. It enters only the inclusive scenario.",
      "status": "unresolved",
      "supporting_observation_ids": [
        "OBS_CSB1130_006_1",
        "OBS_CSB1130_006_2",
        "OBS_GEONAMES_163345"
      ],
      "temporal_scope": {
        "slice": 1130
      }
    },
    {
      "challenging_observation_ids": [],
      "claim_id": "E_1130_ANTIOCH_POINT",
      "entity": "Principality of Antioch",
      "rationale": "The cited observations support this deliberately narrow semantic role.",
      "semantic_role": "point_control",
      "slice": 1130,
      "spatial_scope": {
        "kind": "point"
      },
      "statement": "Antioch is retained as a point-control anchor only. Antioch identifies the principality core in 1130; the city anchor does not define its perimeter.",
      "status": "supported",
      "supporting_observation_ids": [
        "OBS_CSB1130_008_1",
        "OBS_CSB1130_008_2",
        "OBS_GEONAMES_323779",
        "OBS_CSB1130_008_3"
      ],
      "temporal_scope": {
        "slice": 1130
      }
    },
    {
      "challenging_observation_ids": [],
      "claim_id": "E_1130_EDESSA_POINT",
      "entity": "County of Edessa",
      "rationale": "The cited observations support this deliberately narrow semantic role.",
      "semantic_role": "point_control",
      "slice": 1130,
      "spatial_scope": {
        "kind": "point"
      },
      "statement": "Edessa is retained at reduced model weight. The evidence names Joscelin as count of Edessa in the adjacent 1131 narrative, so the one-year bridge remains an explicit uncertainty.",
      "status": "supported",
      "supporting_observation_ids": [
        "OBS_CSB1130_010_1",
        "OBS_CSB1130_010_2",
        "OBS_CSB1130_010_3",
        "OBS_GEONAMES_298333"
      ],
      "temporal_scope": {
        "slice": 1130
      }
    },
    {
      "challenging_observation_ids": [],
      "claim_id": "E_1187_CAIRO_POINT",
      "entity": "Ayyubid Sultanate",
      "rationale": "The recovered material does not yet satisfy the public baseline threshold; the claim remains scenario-only.",
      "semantic_role": "disputed",
      "slice": 1187,
      "spatial_scope": {
        "kind": "point"
      },
      "statement": "Cairo is a plausible Ayyubid political center, but the reviewed page names Egypt rather than Cairo. It enters only the inclusive scenario.",
      "status": "unresolved",
      "supporting_observation_ids": [
        "OBS_CSB1187_001_1",
        "OBS_CSB1187_001_2",
        "OBS_GEONAMES_360630"
      ],
      "temporal_scope": {
        "slice": 1187
      }
    },
    {
      "challenging_observation_ids": [],
      "claim_id": "E_1187_DAMASCUS_POINT",
      "entity": "Ayyubid Sultanate",
      "rationale": "The cited observations support this deliberately narrow semantic role.",
      "semantic_role": "point_control",
      "slice": 1187,
      "spatial_scope": {
        "kind": "point"
      },
      "statement": "Damascus is retained as an Ayyubid political-center anchor. A page-addressable scholarly account styles Saladin sultan of Damascus in the 1187 narrative; no imperial perimeter follows from the point.",
      "status": "supported",
      "supporting_observation_ids": [
        "OBS_CSB1187_001_1",
        "OBS_CSB1187_001_2",
        "OBS_GEONAMES_170654",
        "OBS_CSB1187_001_3"
      ],
      "temporal_scope": {
        "slice": 1187
      }
    },
    {
      "challenging_observation_ids": [],
      "claim_id": "E_1187_JERUSALEM_POINT",
      "entity": "Ayyubid Sultanate",
      "rationale": "The cited observations support this deliberately narrow semantic role.",
      "semantic_role": "point_control",
      "slice": 1187,
      "spatial_scope": {
        "kind": "point"
      },
      "statement": "Jerusalem is retained as a point-control anchor only. Jerusalem was under Ayyubid control by the end-of-year 1187 convention.",
      "status": "supported",
      "supporting_observation_ids": [
        "OBS_CSB1187_003_1",
        "OBS_CSB1187_003_2",
        "OBS_CSB1187_003_3",
        "OBS_GEONAMES_281184",
        "OBS_CSB1187_003_4"
      ],
      "temporal_scope": {
        "slice": 1187
      }
    },
    {
      "challenging_observation_ids": [],
      "claim_id": "E_1187_ACRE_POINT",
      "entity": "Ayyubid Sultanate",
      "rationale": "The cited observations support this deliberately narrow semantic role.",
      "semantic_role": "point_control",
      "slice": 1187,
      "spatial_scope": {
        "kind": "point"
      },
      "statement": "Acre is retained as a point-control anchor because the reviewed Ibn Shaddad pages name its 1187 capture or surrender. The point does not establish a coastal polygon.",
      "status": "supported",
      "supporting_observation_ids": [
        "OBS_CSB1187_004_1",
        "OBS_CSB1187_004_2",
        "OBS_CSB1187_004_3",
        "OBS_GEONAMES_295721",
        "OBS_CSB1187_004_ACRE_4"
      ],
      "temporal_scope": {
        "slice": 1187
      }
    },
    {
      "challenging_observation_ids": [],
      "claim_id": "E_1187_JAFFA_POINT",
      "entity": "Ayyubid Sultanate",
      "rationale": "The recovered material does not yet satisfy the public baseline threshold; the claim remains scenario-only.",
      "semantic_role": "disputed",
      "slice": 1187,
      "spatial_scope": {
        "kind": "point"
      },
      "statement": "Jaffa remains unverified in the reviewed primary-source pages. It is excluded from the reviewed baseline and retained only in the inclusive scenario.",
      "status": "unresolved",
      "supporting_observation_ids": [
        "OBS_CSB1187_004_1",
        "OBS_CSB1187_004_2",
        "OBS_CSB1187_004_3",
        "OBS_GEONAMES_293253"
      ],
      "temporal_scope": {
        "slice": 1187
      }
    },
    {
      "challenging_observation_ids": [],
      "claim_id": "E_1187_ASCALON_POINT",
      "entity": "Ayyubid Sultanate",
      "rationale": "The cited observations support this deliberately narrow semantic role.",
      "semantic_role": "point_control",
      "slice": 1187,
      "spatial_scope": {
        "kind": "point"
      },
      "statement": "Ascalon is retained as a point-control anchor because the reviewed Ibn Shaddad pages name its 1187 capture or surrender. The point does not establish a coastal polygon.",
      "status": "supported",
      "supporting_observation_ids": [
        "OBS_CSB1187_004_1",
        "OBS_CSB1187_004_2",